{
  "$schema": "./sedd.schema.json",
  "specsDir": ".sedd",
  "branchPattern": "{{id}}-{{name}}",
  "autoSplit": {
    "enabled": true,
    "maxLines": 400
  },
  "hooks": {
    "assertive": true,
    "skills": ["langchain-expert", "architecture-mapper", "defect-analyzer"],
    "checkOnlyCurrentMigration": true,
    "showSyncWarnings": true,
    "blockOnSyncError": false
  },
  "git": {
    "autoCommit": false,
    "autoPush": false,
    "messagePattern": "{{type}}({{id}}): {{message}}"
  }
}
